Review,Positive Score,Negative Score
"Can't log in on computer, only on phone. That does not work for us older folks, because we cannot make print bigger on phone. It is also easier when I pay my bills to do it online.",0.8932741284370422,0.10672587156295776
"Can't log in, phone app only, no one answers the phone.",0.9970729351043701,0.0029270420782268047
No issues,0.8649346232414246,0.13506537675857544
I have had nothing but good experiences with this company. I'm glad I opened this account.,0.9955125451087952,0.00448743486776948
"The application and approval process was very easy. However, I didn't realize that support is app only. You cannot login to your account online. Also there is no auto pay and I added my bank account thinking it would be autopaid - it was not. I was immediately charged a late fee the next day even though I logged into the app to initiate a payment. Customer service was great and they explained that they did not support auto pay of bill every month. I wish I knew this up front though. So note that you will have to manually keep track of the billing and pay 5 days in advance because payments take 3-5 business days to process. Other than that, this card is great and I like the customer service.",0.9988355040550232,0.0011645134072750807
I appreciate that this company was willing to give me a chance after making some mistakes. I'm now happily rebuilding my credit.,0.9983540773391724,0.0016459602629765868
"I applied and was approved, the application process was easy. I highly recommend this card.",0.9976654052734375,0.0023346105590462685
"GREAT CARD TO HAVE AND WOULD RECOMMEND TO EVEYONE,THANKS SPARROW",0.9986012578010559,0.0013987154234200716
The experience I've had with this card so far has been exceptional. Highly recommend,0.9995859265327454,0.00041406360105611384
I got this card to rebuild my credit. So far so good. Web portal is easy to navigate. Payments fit my budget. Very satisfied with this card.,0.9981563687324524,0.0018436622340232134
"I was in a place where I had more month than money, so my credit rating was taking a nose dive. I applied for and was issued a card to help me get to a better place financially. Thank you for giving me a chance Sparrow!",0.9927477240562439,0.007252334617078304
Really awesome card. They keep in touch with you and actually care about you as a customer don’t overload with crazy fees either. Highly recommend,0.99933260679245,0.0006673640455119312
"No problem once I was approved was able to use when I was ready, was grateful for the chance",0.9964805245399475,0.0035194947849959135
I am rebuilding my credit rating and they were fantastic company to work with,0.9968776702880859,0.0031222873367369175
I was approved instantly and the customer service is great.,0.9988859295845032,0.0011140842689201236
Quick approval and received it within a week. No complaints!,0.9972817897796631,0.002718178788200021
Simple to use no shenanigans site is good with no glitches,0.9939457774162292,0.006054258439689875
I haven’t had any issues with using or paying the bill.,0.8417462110519409,0.1582537591457367
It took almost 7 weeks to receive my card in the mail. When I did i activated it immediately. Said activation was successful then I was declined. Called the company they said they turned the card off because it took over 60 days to activate. Makes no sense and clearly taking 7 weeks to send it to me was on them. Asked if I could speak to a supervisor. The man named egl said he had no supervisor he’s the boss. I know this is not true and I was lied to. Very shady will never deal with them again and I hope this does not affect my credit,0.9983774423599243,0.0016225622966885567
Finally a credit card that actually cares!!!,0.9910218119621277,0.008978221565485
"Wlthey lick and choose when to report your credit balance. Put a charge on it before the 1st bill and they reported it, paid to 0 before first bill... month and half later never reported the balance. Canceled. Low balance anyways with no way to increase for 6 months",0.9987695813179016,0.0012303681578487158
"no problems at all, paying your card is convenient with the app and processes right away, annual fee could be cheaper",0.9269129633903503,0.07308699190616608
Haven't had a problem with this card and would recommend it to others,0.993658721446991,0.006341289263218641
I was approved for the card with no issues. But upon approval I only got a $300 limit. Even though the first year annual fee is only $59 not worth having a fee of 33% of the limit thereafter. Had I known it was only going to be $300 limit I would have never applied. Closed the account before I ever got the card.,0.9987471103668213,0.0012528437655419111
This card grows with you. Thanks for giving me the chance to start over without having the best credit score.,0.9983364939689636,0.0016635559732094407
"Good card to have. I read other ppl on here saying they were approved by CK. This not correct. Your approval is through the cardholder. CK is only a recommendation platform. Repayment is lightening fast! If you can’t control your spending, credit cards are NOT for you. Sparrow is great.",0.998836100101471,0.0011639201547950506
Great card and easy to use and easy to apply,0.9992528557777405,0.0007471374119631946
Was approved through CreditKarma and everything was so smooth from start to finish. Thank You,0.9991136193275452,0.0008864051778800786
So far very good card to get credit restarted,0.996292233467102,0.0037078415043652058
It seems like a good card,0.5716254711151123,0.4283745288848877
Received quickly,0.9983876943588257,0.0016122696688398719
"I am rebuilding my credit and saw that my approval odds were good. I applied and was approved. The virtual card declined nearly everywhere except for Uber. When I received the physical card, I no longer had issues. I pay thus card 3 times a month so I hope that this card helps improve my credit so I can be approved for an Amex or Chase card. So far, my credit score is increasing.",0.9834772944450378,0.016522705554962158
Opened account used card fine after a month of trying to get online to set up payment won't let me on through the app or online have been trying for almost a month. Called multiple times and nothing has been fixed and was told I am the only person who has this problem,0.9983353018760681,0.0016646918375045061
"They don't even have a website, just an ""APP"", seriously?",0.998007595539093,0.001992378383874893
"Fast approval, making payments are super easy, and reflecting the account right away. Very happy with this card company",0.9977618455886841,0.0022381008602678776
As advertised for sure! With proper monthly payments they will increase your available credit as well!,0.9631432890892029,0.03685667738318443
I have only had the card about 6 months but so far so good. I haven’t had any problems.,0.9992879033088684,0.0007121082162484527
I am glad I was approved and have the opportunity to grow my credit score..,0.9935042262077332,0.006495829671621323
My experience so far has been nothing short of wonderful!,0.9986552000045776,0.0013448302634060383
My experience so far has been better than expected. I am truly satisfied with Sparrow.,0.9989833235740662,0.0010166612919420004
I was approved for this card with a limit if $300. This will help me rebuild my credit . Thank you.,0.9975805282592773,0.002419440308585763
Great card to have. Easy to use app.,0.9980990290641785,0.0019010186661034822
No hidden fees. Very transparent and haven't had any issues. Thanks Sparrow!,0.998691737651825,0.0013083122903481126
It was easy to set up online plus set up useful alerts which helps when you are wanting to rebuild your credit,0.9816022515296936,0.018397793173789978
Very good so far,0.9994679093360901,0.0005320634227246046
Great to do business with,0.9983774423599243,0.0016225469298660755
Came in hand when I needed it,0.9965206384658813,0.0034793876111507416
Very happy I got approved for this card I love it hope company the best,0.9991075396537781,0.000892459589522332
Easy process application process and great app that makes paying and staying on track super easy and fun!,0.999414324760437,0.0005856733187101781
"No gimmicks, straight forward from the beginning, credit limit increases",0.5561180710792542,0.44388192892074585
Awesome card. Customer service is great and always there to help you.,0.9989110231399536,0.0010889979312196374
